{
  "schema_version": "rtos-diagnosis-suite-v1",
  "suite_id": "phase6_synthetic_suite",
  "generated_at": "2026-07-10T00:00:00+08:00",
  "description": "Small synthetic RTOS diagnosis fixture suite for approved P6.2 work. It keeps logical trace references in-suite and writes tiny companion files beside the generated output.",
  "cases": [
    {
      "schema_version": "rtos-diagnosis-case-v1",
      "case_id": "phase6_synthetic_priority_inversion",
      "case_kind": "priority_inversion",
      "title": "Priority inversion synthetic fixture",
      "description": "Small synthetic case where the candidate extends mutex blocking for a higher-priority task.",
      "baseline_trace": {
        "trace_id": "baseline_priority_inversion",
        "trace_ref": "logical://rtos_diagnosis_synthetic/priority_inversion/baseline",
        "trace_kind": "logical_reference",
        "notes": [
          "Suite metadata keeps logical references only.",
          "Companion synthetic trace is written beside generated output."
        ]
      },
      "candidate_trace": {
        "trace_id": "candidate_priority_inversion",
        "trace_ref": "logical://rtos_diagnosis_synthetic/priority_inversion/candidate",
        "trace_kind": "logical_reference",
        "notes": [
          "Suite metadata keeps logical references only.",
          "Companion synthetic trace is written beside generated output."
        ]
      },
      "expected_root_cause": {
        "root_cause_id": "root_priority_inversion",
        "root_cause_kind": "priority_inversion",
        "summary": "Low-priority holder blocks a higher-priority task through a shared mutex for longer in the candidate fixture."
      },
      "expected_affected_entity": {
        "entity_kind": "task",
        "entity_id": "task_high_priority",
        "resource_id": "resource_shared_lock",
        "task_id": "task_high_priority"
      },
      "expected_evidence_refs": [
        {
          "ref_kind": "logical_task",
          "ref_id": "task_high_priority",
          "required": true
        },
        {
          "ref_kind": "logical_resource",
          "ref_id": "resource_shared_lock",
          "required": true
        }
      ],
      "expected_closure_mode": "reference_only",
      "expected_replay": {
        "replay_required": false,
        "expected_replay_pass": null,
        "equivalence_scope": "not_evaluated"
      },
      "claim_class": "report_only",
      "tags": [
        "phase6",
        "synthetic",
        "fixture",
        "report_only"
      ],
      "notes": [
        "Synthetic fixture case only; trace_ref remains logical.",
        "Companion files are small reproducible text artifacts.",
        "No replay verdict or benchmark metric is attached."
      ]
    },
    {
      "schema_version": "rtos-diagnosis-case-v1",
      "case_id": "phase6_synthetic_irq_latency_spike",
      "case_kind": "irq_latency_spike",
      "title": "IRQ latency spike synthetic fixture",
      "description": "Small synthetic case where candidate interrupt service starts later than the baseline envelope.",
      "baseline_trace": {
        "trace_id": "baseline_irq_latency_spike",
        "trace_ref": "logical://rtos_diagnosis_synthetic/irq_latency_spike/baseline",
        "trace_kind": "logical_reference",
        "notes": [
          "Suite metadata keeps logical references only.",
          "Companion synthetic trace is written beside generated output."
        ]
      },
      "candidate_trace": {
        "trace_id": "candidate_irq_latency_spike",
        "trace_ref": "logical://rtos_diagnosis_synthetic/irq_latency_spike/candidate",
        "trace_kind": "logical_reference",
        "notes": [
          "Suite metadata keeps logical references only.",
          "Companion synthetic trace is written beside generated output."
        ]
      },
      "expected_root_cause": {
        "root_cause_id": "root_irq_latency_spike",
        "root_cause_kind": "irq_latency_spike",
        "summary": "Interrupt service response is delayed beyond the expected latency envelope in the candidate fixture."
      },
      "expected_affected_entity": {
        "entity_kind": "irq",
        "entity_id": "irq_timer_tick",
        "irq_id": "irq_timer_tick"
      },
      "expected_evidence_refs": [
        {
          "ref_kind": "logical_irq",
          "ref_id": "irq_timer_tick",
          "required": true
        },
        {
          "ref_kind": "logical_trace_window",
          "ref_id": "window_irq_latency_spike",
          "required": true
        }
      ],
      "expected_closure_mode": "reference_only",
      "expected_replay": {
        "replay_required": false,
        "expected_replay_pass": null,
        "equivalence_scope": "not_evaluated"
      },
      "claim_class": "report_only",
      "tags": [
        "phase6",
        "synthetic",
        "fixture",
        "report_only"
      ],
      "notes": [
        "Synthetic fixture case only; trace_ref remains logical.",
        "Companion files are small reproducible text artifacts.",
        "No replay verdict or benchmark metric is attached."
      ]
    },
    {
      "schema_version": "rtos-diagnosis-case-v1",
      "case_id": "phase6_synthetic_mutex_hold_inflation",
      "case_kind": "mutex_hold_inflation",
      "title": "Mutex hold inflation synthetic fixture",
      "description": "Small synthetic case where candidate keeps the same mutex longer on a control path.",
      "baseline_trace": {
        "trace_id": "baseline_mutex_hold_inflation",
        "trace_ref": "logical://rtos_diagnosis_synthetic/mutex_hold_inflation/baseline",
        "trace_kind": "logical_reference",
        "notes": [
          "Suite metadata keeps logical references only.",
          "Companion synthetic trace is written beside generated output."
        ]
      },
      "candidate_trace": {
        "trace_id": "candidate_mutex_hold_inflation",
        "trace_ref": "logical://rtos_diagnosis_synthetic/mutex_hold_inflation/candidate",
        "trace_kind": "logical_reference",
        "notes": [
          "Suite metadata keeps logical references only.",
          "Companion synthetic trace is written beside generated output."
        ]
      },
      "expected_root_cause": {
        "root_cause_id": "root_mutex_hold_inflation",
        "root_cause_kind": "mutex_hold_inflation",
        "summary": "A mutex is held longer in the candidate fixture than in the baseline fixture."
      },
      "expected_affected_entity": {
        "entity_kind": "mutex",
        "entity_id": "mutex_control_path",
        "resource_id": "mutex_control_path"
      },
      "expected_evidence_refs": [
        {
          "ref_kind": "logical_mutex",
          "ref_id": "mutex_control_path",
          "required": true
        },
        {
          "ref_kind": "logical_task",
          "ref_id": "task_mutex_holder",
          "required": true
        }
      ],
      "expected_closure_mode": "reference_only",
      "expected_replay": {
        "replay_required": false,
        "expected_replay_pass": null,
        "equivalence_scope": "not_evaluated"
      },
      "claim_class": "report_only",
      "tags": [
        "phase6",
        "synthetic",
        "fixture",
        "report_only"
      ],
      "notes": [
        "Synthetic fixture case only; trace_ref remains logical.",
        "Companion files are small reproducible text artifacts.",
        "No replay verdict or benchmark metric is attached."
      ]
    },
    {
      "schema_version": "rtos-diagnosis-case-v1",
      "case_id": "phase6_synthetic_queue_wait_backlog",
      "case_kind": "queue_wait_backlog",
      "title": "Queue wait backlog synthetic fixture",
      "description": "Small synthetic case where candidate backlog grows between producer and consumer events.",
      "baseline_trace": {
        "trace_id": "baseline_queue_wait_backlog",
        "trace_ref": "logical://rtos_diagnosis_synthetic/queue_wait_backlog/baseline",
        "trace_kind": "logical_reference",
        "notes": [
          "Suite metadata keeps logical references only.",
          "Companion synthetic trace is written beside generated output."
        ]
      },
      "candidate_trace": {
        "trace_id": "candidate_queue_wait_backlog",
        "trace_ref": "logical://rtos_diagnosis_synthetic/queue_wait_backlog/candidate",
        "trace_kind": "logical_reference",
        "notes": [
          "Suite metadata keeps logical references only.",
          "Companion synthetic trace is written beside generated output."
        ]
      },
      "expected_root_cause": {
        "root_cause_id": "root_queue_wait_backlog",
        "root_cause_kind": "queue_wait_backlog",
        "summary": "Queue consumers lag behind producers and increase queue backlog in the candidate fixture."
      },
      "expected_affected_entity": {
        "entity_kind": "queue",
        "entity_id": "queue_sensor_events",
        "resource_id": "queue_sensor_events"
      },
      "expected_evidence_refs": [
        {
          "ref_kind": "logical_queue",
          "ref_id": "queue_sensor_events",
          "required": true
        },
        {
          "ref_kind": "logical_task",
          "ref_id": "task_queue_consumer",
          "required": true
        }
      ],
      "expected_closure_mode": "reference_only",
      "expected_replay": {
        "replay_required": false,
        "expected_replay_pass": null,
        "equivalence_scope": "not_evaluated"
      },
      "claim_class": "report_only",
      "tags": [
        "phase6",
        "synthetic",
        "fixture",
        "report_only"
      ],
      "notes": [
        "Synthetic fixture case only; trace_ref remains logical.",
        "Companion files are small reproducible text artifacts.",
        "No replay verdict or benchmark metric is attached."
      ]
    },
    {
      "schema_version": "rtos-diagnosis-case-v1",
      "case_id": "phase6_synthetic_task_starvation",